,review
35,"If you want an antithesis of a ""relaxing day at the beach"", by all means go. Or if you  want to have a stressful day or an unusual experience. Unfortunately in the entire Cartagena area, there is a culture of extreme disrespect of tourists. You are viewed as a bag of money and everything is done to make you part with it.Since the very moment you appear on the beach, you are surrounded by peddlers. They will latch onto you and will continuously try to sell something or just find some other way to get your money. This are not your usual beach salesmen. These don't take no for an answer. Every couple of minutes they bother you and forcefully push something onto you. Just like another reviewer said, the only time you can relax is when you are in the water and not too close to the shore. At the end you just want to leave as soon as possible - it feels like a constant war against the peddlers.The snorkeling tour is a joke - you don't get a breathing tube or fins, only masks, so you can't really snorkel. Also there are no corrals or other marine animals, only fish.The beach would have been OK if not for this, but it's nothing special compared to Mexico and other places."
36,"I’ve never been more uncomfortable a day in my life, let alone a day that was supposed to be relaxing on the beach. Traveling by car, locals stand in a line in the middle of the road to force your car to stop just to try to sell you a stop on the beach. If you say no, they sprint after your car, reaching in the windows and banging on the doors. When you finally arrive on the beach, you are swarmed by seller after seller, many who don’t want to take no for an answer. The only way to avoid their harassment is to go in the water, which you can only do for so long. On top of this all, the people who you do choose to buy something from are liars. Our check for our breakfast and drinks came and was $250.000 pesos instead of $130.000 pesos. We left the beach early because it was excruciatingly stressful... the exact opposite of what it’s meant to be."
37,"Playa Blanca is one of the most beautiful places I have visited😍. White sand, crystal water. RECOMMENDATIONS: 1. Take a tour... it will be cheaper and it includes lunch 🥙 and snacks 2. Only cash💵 is accepted 3. Bring your drinks since they are expensive at the beach (you can rent a cooler with ice for $5)4. ⚠️You will find people offering massages. BE CAREFUL!  Don’t let them touch you ❗️❗️They’ll charge. VERY EXPENSIVE. They won’t even ask if you agree ⚠️ Even If it is only on your feet they will charge!!!"
38,Unless you are used to the perils of over crowded third world places I would avoid.  First the road is not in good shape. Next you will litterally be run off the road Litterally! Before arriving by people selling you fake shopping crap   You pay to park then have a rough walk down to three beach. Doable but not for all.  The beach is pretty but practically nobody running the place so jet skis ans boats nearly hit people every 5 minutes.  You will have to bargain for your place to sit. Then expect prices to change when you go to pay. The waves are a bit strong - not for kids   You will be harassed nearly the entire time by people selling crap It may be close to cartegena but just not great. 
39,"Very beautiful beach! While it is really touristy, it is definitely worth at least a day trip. We loved it!"
40,"I was in this beautiful place four or five years ago, I really do not know when it has changed, but I had a quite pleasant experience, the water is so crystal clear that you can see the small fish passing by your side, they offer the services of food, recreation and transport"
41,"What a really nice spot outside of the public beaches of Santa Marta. Besides the sure beauty of this beach and the surroundings, no vendors harassing you every 2 minutes. Nobody bothers you to buy unwanted trinkets. Also, be ready for the bus ride on un paved roads for 45 minutes each way. It was worth it to me. The food was very authentic too."
42,"Be aware that the people working on the boat archange Uliel are thiefs. When you give them you bag to keep it away from the water, they steal money. I wen to the police and they said it happened many time before. The problem is that if you keep your bag with you, it will be completely wet. Police took this matter seriously so let’s see how they can handle it."
43,Very nice and pleasant stay at Crystal beach. The water is super clean and you can see many yellow fishes very close to the sand. There are available chairs/umbrella to rent and a small restaurant.
44,"Absolutely the best beach in Santa Marta. Beautiful water and reefs to snorkel in. Plenty of fish to see while diving. Had an amazing time there just soaking up the sun and sand. Food was good and you will not find a better place to relax than this beach. Ride in on the road is a little rough, but well worth the journey and the locals are friendly and helpful the entire time you are there."
45,Very nice beach near Santa Marta. I used a travel agent to get there but you can also do so on your own. It is a part of Tayrona National Park. After a relatively short drive through the forest/jungle you need to hop on a boat. The beach has local food venues so you will not lack anything... except for the towels which you need to take yourself.
46,0ne of the prettier beaches that I saw in the area.good views lots of  Colombian families great time in nature.
47,"Tayrona could be reached by sea or by land. By land, you need a ticket to purchase ahead ot time.By sea the boats leave from Rodadeo or Santa Marta and are much more enjoyable .  .  .except when there is a lot of wind (60 to 80 MPH) and the boats do not leave.Before leaving, ask for the right season to visit this beautiful park."
48,"To all fellow travelers this is a warning to all planing to take a boat ride to playa crystal...please do not under any circumstances take the boat, please go buy bus. Here is why: Do not get disillusioned by the calm bay of Taganga because as soon as the boat goes around the corner the sea becomes wild and rough and the waves can reach up to 5 meters. The boat is a small fishing boat with a captain who does not seem to care at all about safety or about the lives of others. The waves got so high and everyone was just screaming and panicking on the boat but the captain did not bother about us at all.He just went on faster and faster and most of us on the boat thought that it was game over and that we would die. When we finally arrived at playa crystal i told the captain that it was irresponsible of him to take us out with such rough seas and he just laughed and replied by saying that the sea was not rough, that this was a totally normal condition! I wonder how many have not made it to playa crystal and have landed up drowning in the sea.  A trip by boat from Taganga should be illegal! Worst experience of my life!!!"
49,"I was not sure if we should take the bus or boat because I read bad reviews of the boat and I wasn't sure if my elderly mother and father in law would be able to handle the rough ride. In the end they decided not to go and I'm so glad because they would not have been able to even get into the boat. There is no dock or pier so you need to be able to jump from the ground up on to the side of the boat and then swing yourself inside. An easy task for some but not all! The boat ride was really rough; in the front the people were bouncing all around from the waves rocking the boat, and in the back we were constantly sprayed by waves so much that I could barely keep my eyes open. When we got to the beach it was completely packed and not the tranquil paradise we were promised. I understand that it was high season but I honestly would have preferred to stay in Santa Marta than spend the day on that bumpy boat ride and crowded beach. Next time I would take the bus and go to a different beach."
50,"Crystal clear water and a nice view. Don’t have bathrooms or bars, it’s just a beautiful beach. You can park the mulita along the road. "
51,"When you do your trip around the island in a rented car, you must stop in San Luis! There are very few tourists, that`s why we could see a lot of fishes, this beach is not crowded as Sprat Bight and Rocky Cay. There were chairs in the sand, i beleive they were from some hotel nearby. But in the part we stayed, there was no place to buy food, we brought our own."
52,"Much cleaner beach then San Andrés main beach, worth the bus trip out every day, great views, chilled out beaches there's a really good beach front restaurant which isn't super expensive and the portions are good too! "
53,"The water is calmer than in other sides of the island and it's very clear.As a recommendation for this and many places in San Andrés, we could help as tourists getting some dog food, and leave it in different spots or feed some dogs, since the locals seem not to care about them."
54,"In my opinion it is just ok  place , food was good. I had fish , if you buy food there they don’t charge you for the Chairs and table for all days. No fish to see there  you need to swing far to see if any lol Over all was ok "
55,"This side of the island is the best option for people who prefer calm atmosphere though in weekends some people use to get there and put outloud music on their cars, but most of the time this is a really quiet place."
56,"It's a good beach where you can have some drinks like the famous ""coco loco"". The beach is ""small"" (not a great ""sand"" area), but the natives provide some chairs so you can get some sun with no cost, you pay only what you drink for. "
57,"We only spent an hour or so in San Luis beach before having lunch at Donde Francesca. Maybe we got lucky but it was completely empty. White sandy beach with transparent blue water, no waves. The most beautiful beach in San Andres."
58,"Hands down the best beaches of San Andres.  They are not just sand but lots of rocky formations found that let you take great pics, and a few feet away from the shore and you can find coral formations and plenty of fish and marine life to observe.  If you go to San Andres, visit the San Luis beaches.   Amazing.  Las mejores playas de la isla.  Muchas formaciones rocosas para tomar fotos espectaculares y a solo unos metros de la costa se puede apreciar una abundancia de vida marina.   Totalmente recomendado."
59,The san luis beach is a bit more off the grid than the main beaches since its on the other side of the island so you can get a bit more privacy here. The beaches are always white and the water has different tones of blue. This place is great for picture taking and getting into the water.
60,"We booked Marina beach club directly via e-mails. It was not cheap but covered boattrip, welcome drink, some fruits, lunch, covered sunbed, toilet, shower. The club itself is very pretty, nice design, comfortable, well kept, Everybody was very polite and helpful. There is wonderful view on Bocagrande.. it is very pleasant and relaxable place if you like to stay in one place."
61,great place great view safe and clean  good ameneties nice beach and waves good food and panoramic recommended 
62,"Got approach by a tour vendor  while having breakfast,  offering tours showin pictures of his boats, said it was 40.000  had hard time contact him next day that was a sign I SHOULD  paid attention,  call me back later trougth was up and meet us at boca grade beach  said that we had to talked to his brother about pricing charged like 200.000 for the whole thing, wich I thought it was gonna b nice we got to  tierra bomba beach, nobody there he said people come later but nobody went there had some kiosks and beach chairs and a restaurant with some locals, only locals walk by beach some in motorcycles  and some with machetes OMG!! we wanted  do diving cuz the said is ok,  it wasn't they said we had to walked  a little for better diving  but the said it was dangerous walking around,  lunch was ok,  no public bathrooms, only had one no ok bathtoom, Beach was ok,  charged for xtra drinks, one gay from restaurant wanted trade our diving equipment for some cook dinner with fish we said not,,  ride back  just ok,  overall  terrible overcharged  be aware of these guys they are  scammers.  We can get better for less price.  I hope police control these people some day."
63,"That was my mistake. Everyone, but everyone went to the beach on Sunday. We got a boat from El Loguito fairly early in the morning. It wasn't crowded then and we walked a short distance being told it would be quiet and not loud music. I went for a walk and not too far away found a beautiful beach by a hotel. Two other children and I played in the water. Few people were there. When I returned to my friends, the beach area was PACKED and the MUSIC was loud. No one seemed to mind to throw their plastic cups on the beach and the motorized boats are constantly coming into the swimming area. Between the heat, the boats and so many people in the water, I felt it was unsafe and stopped swimming.  A family of 4 sitting by our side polished off a bottle of Johnny Walker. I should have exchanged this day to stay at our beautiful condo in Boca Grande. The only thing good was the red snapper that I had for lunch. It was well prepared I enjoyed it with an alcohol free cold Pina colada made from fresh pineapple."
64,"We went there for one day. The trip and also the island is disappointing. Save your time!If you want to know why: We bought two one-day-tickets for each 55’000 Pesos which should include the boat, taxi-costs and also the food. At the end of our day, we had to pay additionally for lunch and the seats at the beach (another 170‘000 Pesos!). The police couldn‘t help us and we didn‘t get any money back. Also, we weren‘t able to enjoy the time there because every guy trys to sell you all kind of stuff. "
65,It was definitely worth it we had a blast. Great Escape from America and enjoy the simple things in life
66,"We visited Tierra Bomba with one of the boats starting in Playa Castillo Grande. The boat was yellow and the captain introduced himself as Mike. He charged us more than the recommended 15000$ but we agreed to pay it without much bargaining. He promised to take us back at certain our and said that we have to pay the round trip at the start. He brought us to the island and never came back to pick us up. The island was nice but the beach not particularly clean, water the same color as in the city beaches of Cartagena."
67,"Cartagena Columbia - Our best surprise, clean, fun, Port, went to Teirra Bomba island, private excursion to a private beach bar location the Beach Bomba, we got to arranged pick up area, there was 8 of us, quick boat ride and great beach, water, beer, food Pina's, etc With great friends from the ship."
68,"We went to Bomba Beach yesterday as a party of 8 from Canada, Australia & California.  We were part of a RCCL Panama Cruise with Cartegena as one of our stops.  Our friend from Canada found this place before we set sail & we checked out their reviews on Trip Advisor before we made our reservation which overall were good.We enjoyed adult beverages, beach time and a few had massages for a great price. There are many beach vendors trying to sell beads, hats, scarves, oysters, etc.  You just have to tell them you’re not interested and move on with your day.  There were dogs around the beach lounging around, but were not aggressive whatsoever.  My husband fed a few and stated they slowly took the food from his hand.  They did not jump on tables and were well-behaved.In order to avoid missing the boarding time back on the ship, they offered to take us back early at 2pm instead of their normal first boat departure of 3pm.  The owner even traveled with us on the boat ride back where the boat dropped us off at a dock in the yacht harbor closer to the ship for a small fee.  He wanted to ensure we made it back. Overall, we had a great time at Bomba Beach Club!"
69,Tierra Bomba is a beautiful island with amazing views are the Cartagena skyline. It may be best if you book directly with a beach club/hostel on the island if you are coming from Cartagena. There were many vendors trying to sell services where the boats leave for Tierra Bomba. We read that some are very unreliable and aggressive. We booked with Bomba Beach Club and had a smooth experience. Needless to say if you are looking to get away from the crowded and vendor filled beaches of Cartagena this is an easy 15 minute boat ride away.
70,The only way to get there is by boat. The scenic pictures shown on the internet are nothing like. Black sand and cold water. It has nothing to do with playa Blanca.Do not buy the package with meal included. They tell you that you can choose from 3 different restaurants but when you get there is the same kitchen serving 2 areas.
71,A very nice beach but very expensive if youre a tourist.. the prices are over inflated...just be careful to ask before you get anything...
72,"We visited this beach coming from the Aquarium, thru the Canopy. The view from the top was wonderful, but when getting to the beach itself we noticed the sand was dark and it has lots of rocks, need to be careful when going to the sea. We also expected to leave later but when we were there they said the mast boat is at 3:40pm as the beach needs to be empty by 4pm. This is also a very busy beach that gets full very fast, so make sure you head there early in the morning.The good thing is that it’s very close from Rodadero beach, less than 10min by boat."
73,There is 2 ways to get to this place. One is by chalupa ( small boat ) or hiking up and down the mountain. The place offers clear waters to swim and snorkel with some restaurants to choose from. Cable attraction is a must if you are up for some adrenaline. They will have tents and chairs for rent and lots of water adventure plans for all ages. 
74,"Nice beach to visit, but can get over crowded at times. Plenty of activities for all and good food and drinks are available. Worth an afternoon"
75,"Rocky as hell careful you may cut your feet , l cut my left foot with one of those rocks ! Good luck"
76,"Expect to be charged for everything.  Shades are twice as much as other beaches, food expensive and not good, even the zip line payment was ""incorrect"" and they tried to squeeze extra cash out of us.  It`s a money making machine.  In one restuarant, not only was the fish 40,000 COP, they said to cook it was another 4,000...!!!  Avoid.  There are better ways to throw money away."
77,"Playa Blanca is a very beautiful place, you can enjoy in the company of your family and friends. You have a lot of fun. I really liked fried fish and that I could be in the company of my family, living beautiful moments"
78,"Playa Blanca was a real highlight of our whole Colombia trip. Be prepared for LOTS of people and also being approached at least every 5 or so minutes by vendors, however they are all polite and lovely and move on if you’re not interested. We stayed the night at the very last hostel along the beach which was great as it was quieter and less people/vendors and we basically had our own swimming area so would recommend doing the same! Crowds also die down heaps in the evening and morning. We felt very safe the whole time however did have a friend who ventured off by himself a bit away from the crowds to take photos and did get robbed, so as much as the crowds can be annoying they are better than the potential alternative!"
79,I highly recommend to go to as much Tayrona's beaches as possible. This is an amazing place to spend a few days visiting different beaches.
