,review
57,"Esta playa es ideal si lo que deseas es tener todo el tiempo una vista linda y tranquila del mar. Hay menos gente que en la playa principal de San Andrés, pero el mar golpea un poco mas fuerte."
58,"Fuimos al recorrer la isla en Mula.Es una excelente isla, de área fina, tiene harto oleaje en días de viento.Hay que visitarla si o si."
59,"Nos alojamos en un departamento en la zona de Playa de San Luis, al sur de la Isla. Esta zona es mas tranquila y menos populosa. Y realmente la disfrutamos plenamente. Aguas calidas y transparentes, arena blanca, y amplitud.La recomiendo!"
60,No te cumplen lo que te venden en el tour.  Se suponía que teníamos carpa aparte y llegamos y nos tocó compartir así que pagamos plata adicional para estar en una especie de caseta con las colchonetas sucia!! Lo único que rescatamos es el almuerzo muy rica la mojarra
61,"Mucha gente te ofrece un paquete completo #1 paguen la mitad del tour al principio ,la otra mitad cuando regresen porque sino nadie te responde por el pasaje de regreso#2 busquen solamente lancheros con carnet y si 0ueden guarden por lo menos 2 números de celular de las personas del tour#3 recuerden el nombre de la lancha que los lleva , #4 Cosa que pidan cosa que paguen  porque se demorán toda la vida en atenderSinceramente hay opciones mejores en Cartagena y sus alrededores"
62,"Estuve en un hotel que se llama palamarito beach, la playa es hermosa, la vista espectacular, la lancha salio muy puntual, el punto bajo fue la comida, el almuerzo que te dan con el paquete de estadía es extremadamente sencillo, a mi parecer es mucho dinero que se paga por un almuerzo que es un tipo  ejecutivo en cualquier restaurante, espere mas."
63,"Una playa pequeña llena de chiringuitos y locales donde comer o beber algo, ajetreada, donde los vendedores pasan y ofrecen de todo, y con una vista preciosa de Cartagena. Genial. "
64,"Llegamos con un bote que alquilamos, por recomendación de los marineros. Quisimos apoyar la cocina de los locales, nos pusieron una mesa al pie Del Mar (único positivo) se demoraron más de una hora en traer los platos, los cuales tenían una pésima presentación. Algunos fríos. Para terminar, la cuenta era un atraco (cerca de 25 usd por persona, lo cual es robo en cuanto a calidad y experiencia)"
65,"Salimos desde el hotel caminamos unas 6 cuadras hasta la zona del Hilton donde salen las lanchas a Tierra Bomba,tras negociar unos minutos arreglamos con el lanchero la ida x 20 cop (10 mil c/u)  destaco esto, como ya lo mencione en otros comentarios hay muchos turistas q pagan ida y vuelta y desp, la lancha no viene a buscarlos y tienen q abonar a otro el recorrido, picarda colombina, el mar estaba calmo (a la ida) en Febrero hay mucho viento x lo q en ocasiones el oleaje se torna áspero,en 15 minutos estábamos atracando en la Isla, Playa Punta Arena, hermoso lugar con muy buena vista de la Ciudad zona, Bocagrande , El Laguito, esi bien el mar no es transparente en la zona tiene un color turquesa raro, el agua muy templada,  varios paradores nien preparados para el turismo, excelente atención x 20 mil cop les proporcionan mesa sobra, uso de baño e instalaciones si consumen alli no cobran la mesa, observamos la salida de un crucero desde puerto, pasamos una tarde espectacular, compartimos una charla muy animada con un contingente de Bolivia, luego con una pareja oriunda de Mendoza, como a las 17 emprendimos el regreso al continente, ya era otro el oleaje y se torno mas movida la vuelta, nada extraordinario.Si van a realizar excursiones lacustres extensas ej. Isla Rosario 1 hora y no les agrada la navegación tengan en cuenta q Febrero como lo mencione es muy ventoso y se hace dificil la misma.Es dable destacar q en la Isla hay alojamiento frente al mar aparentemente de buen pasar."
66,"Crucé desde el sector el laguito en Bocagrande en unas barcazas, lo que me costó 10 mil pesos colombianos, esta me dejó en la playa Punta Arenas. Recorrí el largo de la playa caminando por la orilla del mar, lo que destaco es que es una playa hermosa, sin oleaje, agua turqueza y tibia, no tiene nada que envidiar a Barú. Lo otro positivo es que los vendedores no te hostigan y en los restoranes de la playa solo basta con consumir el almuerzo para poder utilizar sombrilla y sillas de playa, hay varios restoranes para elegir. Es una playa muy bella, tranquila y segura, Fui sola y me pude bañar sin problema. "
67,Fuimos a Palmerito un lugar lindo limpio alegre todo adecuado buena la comida y la atencion ..se puede descansar hay kayac motos de agua baile entretenido y una playa segura para nadar ....hermoso lugar
68,Buenas playas. Recomiendo tomar el paseo al beach club Palmarito beach.Que la pasen súper en este lugar solo a 10 min de Cartagena.
69,"Un lugar para pasar la tarde, sino tienes mucho tiempo para visitar las otras islitas. Esta muy recomendable ya que no está lejos, max 10 min desde Bocagrande y los botes te cobran 15 mil pesos ida y vuelta.Hay opciones de lugar donde quedarte, alquilan sillas y hay restaurantes, los lancheros te dejan en los negocios ""conocidos"" por ellos ya que cobran comisiones por personas que llevan, así que si vas averigua antes las opciones que te dan de acuerdo a tu presupuesto. "
70,"es muy bonita la playa para tomarse fotos, el oleaje es perfecto, pero obligado se debe ir con zapatos de playa porque hay mucha piedra pequeña cuando uno entra al mar"
71,Lastima se les ve lo abusivos piden mucho por una carpa 50 mil y las comidas 35-40 mil por plato eso es lo feo ahora de allá Lo bueno es que las aguas siguen siendo muy claras y bonitas
72,"Que tristeza ver en lo que se convirtió esta playa, hace 25 años voy cada 5 años y visito la Amada Santa Marta, trato de visitar en 10 días lo que más puedo, todo es Hermoso, pero PLAYA BLANCA, esta muy fea, hasta la arena cambio mucho, no hay espacio, se adueñaron de todo el espacio en la arena, lo llenaron de comederos feos y toldos, solo deberían permitir 3 0 4 comederos y no más!!.. no hay aforo de gente, durante el día llega y llegan  mas lanchas con mas gente hasta que no hay un solo espacio donde hacerse. La verdad me dio tristeza de ver esta playa, la primera vez q fui hace 25 años era simplemente un paraíso, hoy es un desastre!!.. q falla!.. muy triste!.."
73,"Un lugar demasiado lleno de gente, desordenado, un fiasco nunca volveré, distanciamiento, aforo y protocolos de bioseguridad totalmente ausentes. "
74,Es una playa limpia y agradable muy cerca del Rodadero. Nos gusto a diferencia de otras que lucen sucias
75,"Restaurants are too expensive and they try to cheat tourist. They overchaged people. Los restaurantes son muy tramposos. Siempre se ""equivocan"" en las cuentas y terminan cobrando más. Los platos son caros y no son buenos. En general ven al turista como una alcancía. Mejor ir al Tayrona o a otra playa e ir a un buen restaurante en el rodadero o parque de los novios."
76,Visitamos acuario y playa blanca con empresa taximarino...es la mejor opcion (no porque sea excelente) sino que las demas son peores... durante todo el dia no existe en ningun lado ningun protocolo covid... el acuario lleno total...nada de protocolos...no es malo...pero si muy sencillo...show delfines muy comun (hermosos los animales) playa blanca muy linda....muy...pero muy superior  a baru... mas limpia...menos venderores cansones
77,"Es un lugar hermoso, obviamente va mucha gente, pero uno se hace el ambiente, en lo personal quedamos encantados, nos fue muy bien en todo momento, desde las personas de la lancha que fueron siempre muy claros y correctos en la información, y en el restaurante la atención y el servicio fue excelente. Valió la pena, muy recomendado el lugar."
78,"Fuimos entre semana y con reserva previa, pero realmente el tema del aforo es una gran mentira, habia demasiada gente y a nadie le importaba el tema del distanciamiento.. "
79,"Desde Rodadero sale taxi marino,te ofrece acuario + playa blanca por 60mil COL, si mal no recuerdo. Eso incluye la entrada al acuario y las lanchas desde Rodadero - Acuario - Playa Blanca - Rodadero. A las 15;45 es la última lancha de regreso a Rodadero. El show de delfines en el acuario es a las 10:30 y 12:30, les recomiendo llegar al de las 10;30, para que después aprovechen playa blanca. En playa Blanca hay tirolesa, lo pueden tomar en el acuario hasta playa blanca o viceversa. Cualquier duda me consultan. "
0,"I was there on 1/2021 Cabo de la Vela, Guajira. The activities offered are: unforgettable views, delicious food and a visit to the desert and its beautiful beaches, with impressive sunsets.The service was very good, the people are friendly and you can share with many of the great people and their culture.What I liked the most was the starry night when I slept outside.I would go back because you can breathe and feel peace. a good place to reconnect with yourself."
1,The best place for kite surfing (I reccomend Tawi center) and more. A combination of desert and turquoise Caribbean sea.
2,"In 2020 I traveled to La Guajira, the experience was amazing. I stayed at Cabo de la vela, It was very enriching. It isn’t as the luxury destinities when we imagine beach, there aren’t hotels or luxury restaurants. We stayed in a hut with native people and It was very shocking to see the poverty of the zone, there is a shortage of water, food, clothes. But I was more shocked to see how friendly and nice were the people there, specially the children. I didn't have amenities but I could see the most beautiful sunset I have seen in my life and I could share with fascinating people. The food was very delicios, almost all I ate there was marine food and was yummy but very pricey because they live from tourism and prices are expensive. I still keeping a bracelet I bought to a around 4 years girl, It's heavy seeing a little girl selling handicrafts."
3,"The Cabo de la vela is located in La Guajira, Colombia. I was there 1 year ago I love this place because it is a beautiful destination, a  secluded place of the city weight with amazing landscapes, a place where the beach and the desert come together.  There, you can eat the typical gastronomy of La Guajira, sleep in the beach or in ""chinchorros"", do a tour for the territory, know the wayuu culture and if you have time, you must go to Punta Gallinas to have a complete experience of La Guajira. Our Guide was wonderful, he shows and told us all the places and mistakes of the Cabo, such as the souls in the Pilon de azucar or how  the rainbows are formed in playa arcoiris.  La Guajira is a Magical place, it had many adventures to you "
4,We stayed at the Hilton Beach and Golf Resort but didn’t expect to find great Restaurants on the premise which pleasantly proved me wrong.  We dined at the Italian restaurant Cabo de la Vela and everything we ordered were delicious and the presentation were just as good!  The service was impeccable and friendly!  The Mexican restaurant here was also very good!  A lovely experience!
5,"a place where it seems to see the limits of the world, nature, peace, sunsets and dreaming that these infinite spaces remain unchanged for life"
6,"Made the trek from Riohacha - Cabo de Vela with the idea to continue on to Punto Gallina. To tell you the truth don't bother.  This is one of the hottest, most arid, devoid of anything places that I have ever visited. The village of Cabo de Vela is a series of shacks strung out along the beach.  Water is a huge problem here so you need to carry gallons of it with you.  Hotels are incredibly rustic + food not much better. Its  crazy sunny, crazy hot + and even crazier windy - all the time! It's a great place for kite surfers + watching them is a lot of fun ... but besides watching the kite surfers for an hour or so, the rest is a big, hot, windy snooze.  Basically you are in the midst of a big huge coastal desert with an expanse of desert stretching to Venezuela on one side and the Caribbean on the other. The fact that you are at the most northern point of South America is kind of cool ... but the rest is one big hot, humid, arid, sunny, windy mess of a place. Only for kite surfers + the truly adventurous traveller!"
7,"Excellent place if you want an adventure far from technology, lovely landscapes. This was possible thanks to Magic Tours"
8,"We went here for 2 nights. The place is great for kite surfing and it's quite a special place to visit. It is a shame that it is very polluted (plastic everywhere). Accommodation is basic but there are some good places, washing is with bucket of water and electricity is generally from 6 until about 9pm although apparently there are places with electricity until later.The first night we stayed in accommodation without electricity (although the owners kept telling us there would be electricity any moment) and on plastic matrasses. On the second night we found a nicer accommodation in Cabanas. As a gringo, be prepared to be seen as a walking wallet by many of the locals. Unfortunately many of them seem to lie and just tell you what they think you want to hear in order to get you to buy. We ""booked"" a tour to Puntas Gallinas but the car never showed up. After a couple of hours waiting we managed to get our money back but weren't able to go anymore because it was too late, the tours leave around 5-6am.For food ask for the price before ordering or order from a menu. Also lock up your stuff when you're away,get a room with a lock if you've got valuables. We heard about multiple robberies from other people we met while in town. You can buy nice souvenirs (ie the wayuu bags) here for way less money than in the bigger towns and support the community this way. Would still recommend to visit just be prepared and check online for how much things should cost."
9,"We have had a very good 3 day trip to La Guajira with Kai Ecotravel. The communication with the office (for booking and preparation of the trip) was excellent, and we were lucky to have Victor as our guide. His english is excellent, as well as his knowledge of the area. Moreover, he is making sure that you are having a good experience, while keeping you safe at the same time. We spent one night in a chinchorro, and one night in a double room. I must admit that the room was more comfortable, but it was also a good experience to sleep in the chinchorro. At each meal, one drink was included, which is also nice. I wish we had chosen the 4day trip, as we would have loved to spend more time in this fascinating part of Colombia! "
10,no hay palabras para expresar. la belleza naturallun regalo de Dio para mankind's the beach the great body of water the. sand so white the birds 🦅 the eguanas so beautiful
11,"This place is packed like a theme park and its during Covid. People are set up under the umbrella that I paid for.  Kids everywhere and the boats keep coming.  Great if you have a bunch of kids.  Absolutely horrible for a couple or anyone else that wants a calm day at the beach.  Either way, swim with your mouth closed. Never again. "
12,"Most say, really nice. Food was great! Coco loco were good! Snokeling was pretty and i saw 2 big rays swimming by! Leguana's on the beach. Great weather"
13,"Another thing I was tasked to do for work. A terrible, frightening nightmare of an experience. Tons of people packed, and I mean packed until you couldn't breathe on a rickety boat. Hoards of tourists departing from other boats. People picking the stingrays out of the water and posing with them.Feeding them items that will kill them. I literally saw a sting ray die right before my eyes."
14,"This is a true paradise, the water is cristal clear and tones of blue and turquoise are just amazing. Lush vegetation, the palm trees are beautiful. Around the island the rock formations and the water are great. The short ride to get there is wonderful as you glide through the beautiful ocean. A must do!"
15,"It is a trip, but not that good to go in the beach, because there were a lot of rocks and seemed unsafeEs un lindo paseo, pero no tan bueno para bañarse porque hay muchas piedras y es un poco inseguro por la cantidad de olas y piedras  "
16,"Johnny Cay, it is a beautiful small island just a short boat ride away from Playa Spratt on San Andres Island.  My group of five opted to pay 5000 extra COP each to hire our own boat and ‘host’ for the island. This was the best decision, not only did he secure us with shaded seating but also took care of all our drinks and food. We were able to leave the island when we choose and weren’t jammed pack into one of the tour boats.The island is busy, it can be loud and it is not exactly cheap for food and drink since you can not bring your own. However, in saying that nothing in Colombia is overly expensive.  Take the time to walk around the island, you can do the whole island in approximately 20 mins, but the back of the island is just as beautiful as the front just in a different way. "
17,"Crayon-like blue water, lots of fish and a nice view. It is worth taking a tour there while visiting San Andres"
18,We purchased a 6 hour trip to two cays to include lunch and snorkeling.  When arrived we was told that the trip was not happening and we was rebooked on an afternoon trip.  We was told we could not  get a refund.  So what we got for 45 usd each was a harbor cruise with over priced drinks.  I wish I could give a zero rating.  What a scam 
19,"This key should be in tip top shape if the people in charge would care more about the safety of the tourists that visit the San Andres island yearly. There is not a pier, a loading dock, for the boats (lanchas) to safely and properly disembark passengers. My niece's legs almost got crushed with another boat that hit our boat while attempting to get on the beach.The waves are constantly breaking strongly at the beach...especially if it is a windy day, such, as the one we encountered that day.It's a real shame they don't built that pier, with all the money the government gets from the ""special fee"" they charge the tourists.Millions of dollars collected yearly.This Johnny Cay needs a lot of improvement. It is an accident waiting to happen...until someone gets badly hurt or dies...then, maybe someone will do something about making it a safe place for tourists. "
20,"The sand area us small, tiny. Keep an eye out for little ones as they might wander off to water without you realising. The place has sellers who hound you until you buy."
21,"As a TripAdvisor DESTINATION EXPERT for Colombia with 30 years of visits and now living 4 years in Medellin and exploring just about every city large and small - it is my pleasure to provide this reasoned and accurate review of Playas de Palomino.Unfortunately the beach has all but eroded away and I am told that they lose a few meters of beach each week. The current, the strong waves, the pounding surf? What is causing it who knows.I stayed in Palomino hotel directly on the beach in mid November 2020 and went to take a swim but found it almost impossible as the rock and boulders right under the surf line will make it all but impossible for a person to enter into the ocean without shoes or rubber boots, it is that bad and here I sit almost two weeks later and still have pain in my feet as I attempted to swim.I also look at older photos and see how beautiful the beach use to be but now look at my photos and you will see that it is almost gone.Despite this I was able to take some great walks and just look at some of the photos I took. Oh mother nature is both a beast and she is beautiful as well."
22,Palomino tiene una alma magico!! We recommend to visit especiallly during the slower seasons when there are less tourists. 
23,Make sure you walk right when you come onto the beach for about 40 minutes for a stunning uncrowded stretch of stunning beach.
24,"Palomino is not a beach destination anymore. During the last couple of month the sea swept away the beaches.  Hotels, restaurants are almost falling into the ocean, some are already closed. "
25,"No sure if the other positive reviews here ever saw a real beach or if these are from the hotel owners there but if you're looking for a beach you will be disappointed to see that there is no beach and the small sand line that remains is over crowded of bored tourists who can't swim because you can't swim as there are too many currents and waves .. Overall this place is a trash everything is dirty, chaotic constructions everywhere, over priced low cost hotels .. Just avoid this place .."
26,"Poor city planning or lack of enforcement along the waterline has crippled this poor town. The one redeeming quality, the beach, has been washed away. So now crumbling structures line the water's edge, making it impossible to access or enjoy the beach at all.  There is also a scruffy, druggy vibe, many unfinished structures, and garbage. This could have been such a cool place but it currently is not cool at all. You can sense the sadness of the locals. Definitely has bummer vibes. Perhaps another storm will redeposit some sand in the future."
27,"Well, as you are there, better enjoy what’s really nice: the sea water temperature. We decided to eat somewhere, we found a restaurant at the Hostal Villa Delia. Let’s say that the rice with shrimps was delicious and enough for two people. Other than that we had nothing else to do in Palomino. It’s a very “commercial” spot in this area and very locally touristic. Beach isn’t nice, but ok, it’s not a real Caribbean beach. It’s, let’s say: a 2 stars beach. "
28,"Confused by some of the bad reviews of Palomino beach - it’s really nice! We’ve been to beaches across Asia and South America and we were still impressed by this one. We stayed in a Palomino for a week and went to the beach and swam every day. Yes it is narrow, but there’s still more than enough space to lay down, you can walk all the way along (about 15 minutes) to get to where the river meets the sea, which is really nice, and there’s a few restaurants there where you can get fresh fish and drinks. It’s also really nice because it’s not built up, so it’s just palm trees, beach and sea. You can happily swim there, the waves are really fun to jump around in, and it’s not a busy beach apart from at the weekend. Would definitely recommend!"
29,"How can anyone give this place 4 or 5 stars unless they have never been to the ocean outside of a huge city. Muddy and horrible road leads to an unpleasant narrow strip of sand with a brick building and a couple dodgy restaurants. Also absolutely no ""cool vibe"" as everyone seems to describe. Baffling."
30,Terrible road and so many bad things like dirty place with no safety for cars and pedestrians!!! Please don’t go to this place!! People use the sombreros and massages to ask money and it is a very bad experience!!
31,"August 30th- The beach and water were really nice but the vendors were extremely annoying. the only way you could avoid them is to go in the water but most of the time they follow you in there too. Behind the beach ( where they cook food) is absolutely disgusting, filled with flies and bugs and poop. The restaurant that we ate at was not too good, food portions were very small and their was very limited menu. There was so many boats in the water and very just a very uncomfortable place to swim. It was not the relaxing day we expected. it was really stressful."
32,Very beautiful beach. I was hesitant to go at first after reading some of the reviews. The best way is to find a good driver who can take you and wait for you. We found a good driver for 65  US dollars. We rented two beds for about 13 US dollars. 
33,"A friend who live in Cartegena had a small hut in Playa blanca and he took me out there for the day for a view. It's a 35 minute ride from Cartegena and it range from 45-70 K pesos or public transportation and taxi will range you 20-35K if you want a different adventure. To get to the beach, you turn on a bumpy unpave road that a 1/4 mile long and my first thought was really? A main attraction area with plenty of money coming through and this isn't resolved. But before the turn, there's a bunch of guys trying to stop the car to get paid ahand out. But there's options for boat travel as well that would cost 50K pesos.  I foundthe beach to be dirty with full of makeshift housing with no AC and lots of hammocks to sleep in. It's cool at night but the mosquitos are plentiful and not too many hostel thought of mosquito nets. The food is fine but you're in competition with the flies to eat. Overall, glad it was my friend place and not mines. Not my style of beach living."
34,"Isla barú, Cartagena - ColombiaFirst step is that you are in Cartagena, then you cango in your car or you can take a bus.I was in Barú Island two years ago.in Barú Island, you can swim in the sea, you can fish,you can drive a boat, you can ride in yate, you cango to the luxury hotels, you can drink cocktails,you can drive quad bike, you can do extreme water sports and more.I like Barú island becuase I can do many things, I likethe sea and I like drink cocktails.I liked barú island in general.the services was amazing buy the services was very expensive..I liked the most was the beach.I would go  back because I felt a expercience fantastic."
